{"fields":{"pronouns":"She / Her","name":"Maneesha Papireddygari","email":"maneesha.papireddygari@colorado.edu","website":"papireddygari.github.io","researchInterests":["Algorithmic Economics","Automated Market Makers","Wagering Mechanism","Blockchain Economics","Decentralized Finance","Online Learning Algorithms","Information Elicitation and Aggregation"],"education":[{"year":"2020-2025","degree":"PhD","field":"Computer Science","university":"University of Colorado Boulder","location":"Boulder","researchAdvisor":"Prof. Bo Waggoner"},{"year":"2018-2020","degree":"Master of Arts","field":"Economics","university":"Delhi School of Economics (DSE)","location":"Delhi","researchAdvisor":"Prof. Abhijit Banerji"},{"year":"2011-2015","degree":"Bachelor of Technology","major":"Computer Science Engineering","university":"International Institute of Information Technology (IIIT)","location":"Hyderabad, India","projectAdvisor":"Prof. Rajan K.S."}],"appointments":[{"year":"2025","position":"Post Doctorate Research Fellow","department":"Computer Science","institution":"Boston College","researchAdvisors":["Prof. Jessie Finocchiaro","Prof. Francisco J. Marmolejo - Cossío"]}],"papers":[{"title":"Designing Markets for Information, Bringing Theory Closer to Practice","author":"Maneesha Papireddygari","type":"PhD Thesis","year":"2024"},{"title":"A Computational Complexity Result and Sampling Algorithm for Pricing Combinatorial Constant Product Market Makers","authors":["Maneesha Papireddygari","David Pennock","Bo Waggoner","Xintong Wang"],"type":"Working Paper","year":"2024"},{"title":"A General Theory of Liquidity Provisioning for Prediction Markets","authors":["Adithya Bhaskara","Prof. Rafael Frongillo","Maneesha Papireddygari"],"type":"Pre-print","link":"https://arxiv.org/abs/2311.08725"},{"title":"An Axiomatic Characterization of CFMMS and Equivalence to Prediction Markets","authors":["Prof. Rafael Frongillo","Maneesha Papireddygari","Prof. Bo Waggoner"],"type":"Innovations in Theoretical Computer Science (ITCS) 2024","link":"https://drops.dagstuhl.de/entities/document/10.4230/LIPIcs.ITCS.2024.51","highlight":"Selected for Highlights Beyond EC 2024"},{"title":"Contracts with Information Acquisition, via Scoring Rules","authors":["Maneesha Papireddygari","Bo Waggoner"],"type":"Economics and Computation (EC) 2022","link":"https://dl.acm.org/doi/abs/10.1145/3490486.3538261"}]},"text":"Pronouns : She / Her\nManeesha Papireddygari maneesha.papireddygari@colorado.edu papireddygari.github.io/\nResearch Interests\nAlgorithmic Economics , Automated Market Makers , Wagering Mechanism , Blockchain Economics ,\nDecentralized Finance , Online Learning Algorithms , Information Elicitation and Aggregation\nEducation\n2020-2025 PhD , Computer Science , University of Colorado Boulder , Boulder .\nResearch Advisor : Prof. Bo Waggoner\n2018 - 2020 Master of Arts , Economics , Delhi School of Economics , ( DSE ) , Delhi .\nResearch Advisor : Prof. Abhijit Banerji\n-\n2011 2015 Bachelor of Technology - Major in Computer Science Engineering , International Institute of Information\nTechnology ( IIIT ) Hyderabad , India .\nProject Advisor : Prof. Rajan K.S.\nAppointments\n2025 Post Doctorate Research Fellow , Computer Science , Boston College .\nongoing\nResearch Advisors Prof. Jessie Finocchiaro and Prof. Francisco J. Marmolejo - Cossío\nPapers\n( a - 3 ) alphabetic ordering\nDesigning Markets for Information , Bringing Theory Closer to Practice . Maneesha Papireddygari .\nPhD Thesis 2024 .\nA Computational Complexity Result and Sampling Algorithm for Pricing Combinatorial Constant\nProduct Market Makers . Maneesha Papireddygari , David Pennock , Bo Waggoner , and Xintong Wang\n( a B ) . Working Paper 2024 .\nA General Theory of Liquidity Provisioning for Prediction Markets - Adithya Bhaskara , Prof. Rafael\nFrongillo and Maneesha Papireddygari ( a - 3 ) . Pre - print link - https://arxiv.org/abs/2311.08725\nAn Axiomatic Characterization of CFMMS and Equivalence to Prediction Markets Prof. Rafael\nFrongillo , Maneesha Papireddygari and Prof. Bo Waggoner ( a - 3 ) . Innovations in Theoretical Computer\nScience ( ITCS ) 2024 Link - https : //drops.dagstuhl.de/entities/document/10.4230/LIPIcs . ITCS.2024.51\nSelected for Highlights Beyond EC 2024\nContracts with Information Acquisition , via Scoring Rules - Maneesha Papireddy-\ngari and Bo Waggoner ( a B ) . Economics and Computation ( EC ) 2022 Link\n-\nhttps://dl.acm.org/doi/abs/10.1145/3490486.3538261\nPage 1 of 6 1/6"}